sq,question,option_a,option_b,option_c,option_d,answer,type,category
"170","Which topology has a single central node connected to all devices?","Mesh","Bus","Star","Ring","C","technical","Networking"
"171","Which layer of OSI handles encryption?","Application","Presentation","Session","Network","B","technical","Networking"
"172","What is the purpose of a proxy server?","Filter traffic","Cache requests","Hide client IP","Both B and C","D","technical","Networking"
"173","Which protocol is used for remote secure login?","Telnet","SSH","FTP","HTTP","B","technical","Networking"
"174","What is the maximum number of hosts in a /24 subnet?","254","255","256","512","A","technical","Networking"
"175","Which protocol translates domain names to IP addresses?","DNS","DHCP","FTP","SMTP","A","technical","Networking"
"176","Which device forwards data based on MAC addresses?","Router","Switch","Hub","Firewall","B","technical","Networking"
"177","Which protocol is connectionless?","TCP","UDP","HTTP","SMTP","B","technical","Networking"
"178","Which WAN technology uses packet switching?","Frame Relay","DSL","Ethernet","Wi-Fi","A","technical","Networking"
"179","What is the purpose of a load balancer?","Distribute traffic","Assign IPs","Encrypt data","Route packets","A","technical","Networking"
"180","Which layer of OSI defines electrical signals?","Physical","Data Link","Network","Transport","A","technical","Networking"
"181","Which IP version uses 128-bit addresses?","IPv4","IPv6","IPX","ARP","B","technical","Networking"
"182","What is the primary purpose of ARP?","Resolve IP to MAC","Resolve domain names","Assign IPs","Encrypt traffic","A","technical","Networking"
"183","Which wireless security protocol is most secure?","WEP","WPA","WPA2","WPA3","D","technical","Networking"
"184","Which protocol is used for network time synchronization?","NTP","SMTP","DHCP","FTP","A","technical","Networking"
"185","What does a hub do?","Filter packets","Broadcasts to all devices","Route traffic","Assign IPs","B","technical","Networking"
"186","Which protocol is used for network diagnostics?","FTP","ICMP","SMTP","DNS","B","technical","Networking"
"187","Which type of IP address is assigned temporarily?","Static IP","DHCP IP","Private IP","Loopback IP","B","technical","Networking"
"188","Which protocol is used for email retrieval?","SMTP","IMAP","HTTP","FTP","B","technical","Networking"
"189","What is a broadcast address used for?","Send message to one host","Send message to all hosts in network","Route packets","Assign IPs","B","technical","Networking"
"190","Which OSI layer establishes, manages, and terminates sessions?","Session","Transport","Network","Data Link","A","technical","Networking"
"191","Which protocol provides encryption for VPN tunnels?","IPSec","TCP","UDP","ICMP","A","technical","Networking"
"192","Which layer handles error detection and correction?","Data Link","Network","Transport","Application","A","technical","Networking"
"193","Which protocol is used for transferring web pages?","HTTP","SMTP","FTP","DHCP","A","technical","Networking"
"194","Which addressing type is used in IPv6 for multiple destinations?","Unicast","Multicast","Broadcast","Anycast","B","technical","Networking"
"195","Which routing protocol is distance-vector based?","RIP","OSPF","BGP","EIGRP","A","technical","Networking"
"196","Which routing protocol is link-state based?","RIP","OSPF","BGP","EIGRP","B","technical","Networking"
"197","Which IP address is reserved for loopback?","127.0.0.1","192.168.1.1","10.0.0.1","255.255.255.0","A","technical","Networking"
"198","Which type of NAT maps multiple private IPs to one public IP?","Static NAT","Dynamic NAT","PAT","Port Forwarding","C","technical","Networking"
"199","Which topology connects all devices in a closed loop?","Ring","Bus","Star","Mesh","A","technical","Networking"
"200","Which protocol ensures email delivery reliability?","SMTP","IMAP","POP3","All of the above","D","technical","Networking"
